{
  "events": [
    {
      "candidate": {
        "artifact_digest": "sha256:be96bf257c1c3dfe3c8e3ca756fba9e4dccee985ff350d397ec63e323c938653",
        "pattern_id": "tool-retry-failure",
        "pattern_version": 1,
        "run_id": "efd16fc1-758e-48fd-a765-bb3e27815952",
        "tool_key": "syncmill::board_stats"
      },
      "candidate_id": "167379e8-3436-546b-9dbb-5fa087ab0493",
      "disposition": "accepted",
      "from_disposition": "open",
      "note": null,
      "recorded_at": "2026-07-12T06:00:00+00:00",
      "reviewer": "operator@example.com",
      "sequence": 1
    }
  ],
  "kind": "toolgraph.review-annotations",
  "schema_version": 1,
  "source": {
    "kind": "tracegraph.review-candidates",
    "schema_version": 1,
    "source_report_digest": "sha256:ce66fdf2177955ba4f7d146aadf4e7dea3f85215ece59eee003f043711469e00"
  }
}
